{
  "schema": "subactor.ecosystem-map/v1",
  "generatedAt": "2026-08-19T10:00:00Z",
  "registryId": "subactor-engineering-ecosystem",
  "registryVersion": "0.3.0",
  "registryLifecycle": "candidate",
  "registryHome": {
    "repository": "subactor/registry",
    "role": "HOME"
  },
  "registryDigest": "sha256:4930758b69658f4de3481000e70330beed8abe312c812a8b5bcc950ff30576fd",
  "status": "REVIEW_REQUIRED",
  "sources": {
    "autogrammar": {
      "path": "sources/indexes/autogrammar-2026-08-19.toon.yaml",
      "sha256": "sha256:09fce2609729b130b2d1224821dad947572d29a3cf4a11a5963af41258e47a26",
      "generatedDate": "2026-08-19",
      "moduleCount": 6421
    },
    "subactor": {
      "path": "sources/indexes/subactor-2026-08-19.toon.yaml",
      "sha256": "sha256:60258aecd20713d807307266f61d24ea4b5f288c7537ee169340fd5acb39fc82",
      "generatedDate": "2026-08-19",
      "moduleCount": 6497
    }
  },
  "metrics": {
    "projectCount": 15,
    "verifiedProjectCount": 10,
    "documentedOnlyProjectCount": 5,
    "executionEligibleProjectCount": 9,
    "duplicateHomeCount": 0,
    "manifestCoverage": 0.3667
  },
  "homeOwners": {
    "commercial-offer-standard": [
      "wellmanifest/offer"
    ],
    "commercial-offer-values": [
      "subactor/offer"
    ],
    "engineering-standardization-policy-instance": [
      "subactor/platform"
    ],
    "evolutionary-intent-policy-language": [
      "wellmanifest/policy-dsl"
    ],
    "organization-project-registry": [
      "subactor/registry"
    ],
    "project-manifest-standard": [
      "wellmanifest/new-project"
    ],
    "project-ticket-lifecycle-standard": [
      "wellmanifest/new-project"
    ],
    "subactor-product-vocabulary": [
      "subactor/brand"
    ]
  },
  "projects": [
    {
      "id": "autogrammar/todo2code",
      "organization": "autogrammar",
      "repository": "todo2code",
      "lifecycle": "active",
      "required": true,
      "roles": [
        "planner",
        "intent-extractor"
      ],
      "homeFor": [],
      "adopts": [],
      "capabilities": [
        {
          "id": "intent-evidence-graph",
          "weight": 10,
          "keywords": [
            "intent",
            "evidence",
            "graph",
            "task",
            "todo",
            "git",
            "ast",
            "documentation"
          ]
        },
        {
          "id": "bounded-code-change-planning",
          "weight": 12,
          "keywords": [
            "plan",
            "planning",
            "code",
            "change",
            "remediation",
            "acceptance",
            "patch"
          ]
        },
        {
          "id": "workspace-preflight",
          "weight": 8,
          "keywords": [
            "preflight",
            "workspace",
            "governance",
            "branch",
            "dirty",
            "baseline"
          ]
        }
      ],
      "interfaces": {
        "extractIntent": "uri://todo2code/intent/extract",
        "planCodeChange": "uri://todo2code/code-change/plan",
        "watch": "uri://todo2code/watch"
      },
      "evidence": {
        "status": "VERIFIED",
        "sourceClass": "git_ast",
        "sourceRank": 80,
        "coverage": 1.0,
        "executionEligible": true,
        "observedModuleCount": 337,
        "map": {
          "organization": "autogrammar",
          "path": "sources/indexes/autogrammar-2026-08-19.toon.yaml",
          "sha256": "sha256:09fce2609729b130b2d1224821dad947572d29a3cf4a11a5963af41258e47a26",
          "generatedDate": "2026-08-19",
          "declaredModuleCount": 6421,
          "parsedModuleCount": 6421
        },
        "moduleChecks": [
          {
            "path": "todo2code/dsl-manifest.json",
            "present": true
          },
          {
            "path": "todo2code/goal.yaml",
            "present": true
          },
          {
            "path": "todo2code/schemas/code-change-plan-set.schema.json",
            "present": true
          },
          {
            "path": "todo2code/src/pipeline/pipeline-run.ts",
            "present": true
          },
          {
            "path": "todo2code/src/synthesis/code-change-plan-propose.ts",
            "present": true
          },
          {
            "path": "todo2code/src/services/workspace-preflight.ts",
            "present": true
          }
        ],
        "symbolChecks": [
          {
            "path": "todo2code/src/pipeline/pipeline-run.ts",
            "symbol": "PipelineRun",
            "present": true
          },
          {
            "path": "todo2code/src/synthesis/code-change-plan-propose.ts",
            "symbol": "proposeCodeChangePlans",
            "present": true
          },
          {
            "path": "todo2code/src/synthesis/code-change-plan-propose.ts",
            "symbol": "buildPlanFromDiagnostic",
            "present": true
          },
          {
            "path": "todo2code/src/services/workspace-preflight.ts",
            "symbol": "WorkspacePreflightError",
            "present": true
          }
        ],
        "documents": [],
        "note": null,
        "manifest": {
          "status": "DRIFT",
          "coverage": 0.6667,
          "categories": {
            "identity": {
              "present": true,
              "matches": [
                "todo2code/dsl-manifest.json"
              ]
            },
            "goal": {
              "present": true,
              "matches": [
                "todo2code/goal.yaml"
              ]
            },
            "quality": {
              "present": false,
              "matches": []
            }
          }
        }
      }
    },
    {
      "id": "semcod/giton",
      "organization": "semcod",
      "repository": "giton",
      "lifecycle": "active",
      "required": false,
      "roles": [
        "local-git-emitter"
      ],
      "homeFor": [],
      "adopts": [],
      "capabilities": [
        {
          "id": "local-git-hooks",
          "weight": 9,
          "keywords": [
            "git",
            "hook",
            "pre-commit",
            "post-commit",
            "pre-push",
            "fixup"
          ]
        }
      ],
      "interfaces": {
        "emit": "uri://giton/event/emit"
      },
      "evidence": {
        "status": "DOCUMENTED",
        "sourceClass": "documentation",
        "sourceRank": 40,
        "coverage": 1.0,
        "executionEligible": false,
        "observedModuleCount": 0,
        "map": null,
        "moduleChecks": [],
        "symbolChecks": [],
        "documents": [
          "sources/reports/ecosystem-strategic-technical-report-2026-08-19.md#3.5"
        ],
        "note": "Exact repository map was not attached.",
        "manifest": {
          "status": "NOT_MEASURED",
          "coverage": null,
          "categories": {}
        }
      }
    },
    {
      "id": "semcod/pyqual",
      "organization": "semcod",
      "repository": "pyqual",
      "lifecycle": "active",
      "required": true,
      "roles": [
        "quality-gate"
      ],
      "homeFor": [],
      "adopts": [],
      "capabilities": [
        {
          "id": "declarative-quality-gates",
          "weight": 12,
          "keywords": [
            "quality",
            "gate",
            "validate",
            "validation",
            "test",
            "negative",
            "commit",
            "manifest"
          ]
        },
        {
          "id": "repair-loop",
          "weight": 7,
          "keywords": [
            "repair",
            "retry",
            "finding",
            "stderr",
            "codevalidator"
          ]
        }
      ],
      "interfaces": {
        "evaluate": "uri://pyqual/policy/evaluate",
        "exactHeadGate": "uri://pyqual/gate/exact-head",
        "manifestGate": "uri://pyqual/gate/manifest-conformance"
      },
      "evidence": {
        "status": "DOCUMENTED",
        "sourceClass": "documentation",
        "sourceRank": 40,
        "coverage": 1.0,
        "executionEligible": false,
        "observedModuleCount": 0,
        "map": null,
        "moduleChecks": [],
        "symbolChecks": [],
        "documents": [
          "sources/reports/ecosystem-strategic-technical-report-2026-08-19.md#3.1"
        ],
        "note": "The source report identifies the role; exact CLI/config schema must be pinned from the repository before enforcement.",
        "manifest": {
          "status": "NOT_MEASURED",
          "coverage": null,
          "categories": {}
        }
      }
    },
    {
      "id": "subactor/brand",
      "organization": "subactor",
      "repository": "brand",
      "lifecycle": "active",
      "required": false,
      "roles": [
        "vocabulary-owner"
      ],
      "homeFor": [
        "subactor-product-vocabulary"
      ],
      "adopts": [],
      "capabilities": [
        {
          "id": "product-vocabulary",
          "weight": 7,
          "keywords": [
            "brand",
            "vocabulary",
            "naming",
            "agent-operation",
            "plan-name"
          ]
        }
      ],
      "interfaces": {
        "validateVocabulary": "uri://subactor/brand/validate"
      },
      "evidence": {
        "status": "VERIFIED",
        "sourceClass": "git_ast",
        "sourceRank": 80,
        "coverage": 1.0,
        "executionEligible": true,
        "observedModuleCount": 22,
        "map": {
          "organization": "subactor",
          "path": "sources/indexes/subactor-2026-08-19.toon.yaml",
          "sha256": "sha256:60258aecd20713d807307266f61d24ea4b5f288c7537ee169340fd5acb39fc82",
          "generatedDate": "2026-08-19",
          "declaredModuleCount": 6497,
          "parsedModuleCount": 6497
        },
        "moduleChecks": [
          {
            "path": "brand/dsl-manifest.json",
            "present": true
          },
          {